{
  "scenario_id": "opn_taino_surge",
  "operation": "Project Scipio Surge",
  "theater": "Cuba",
  "description": "Synthetic surge variant with denser threat coverage and shifted patrol emphasis.",
  "center": { "lat": 21.5218, "lon": -77.7812 },
  "tick_seconds": 300,
  "duration_ticks": 12,
  "blue_forces": [
    {
      "id": "UAV-ALPHA",
      "name": "North Orbit",
      "type": "MQ-9",
      "platform": "ISR UAV",
      "heading": 115,
      "speed_kts": 94,
      "sensor_radius_km": 24,
      "default_sector_id": "SEC-CAPITAL",
      "track": [
        [23.1200, -82.4200],
        [22.9800, -81.9800],
        [22.7000, -81.3500],
        [22.3600, -80.7000],
        [22.0400, -80.0500],
        [21.8200, -79.5200]
      ]
    },
    {
      "id": "UAV-BRAVO",
      "name": "Eastern Sweep",
      "platform": "ISR UAV",
      "heading": 292,
      "speed_kts": 90,
      "sensor_radius_km": 22,
      "default_sector_id": "SEC-CENTER",
      "track": [
        [20.1000, -75.9000],
        [20.5000, -76.3000],
        [20.9200, -76.9000],
        [21.3200, -77.5500],
        [21.7200, -78.1000],
        [22.0400, -78.6500]
      ]
    },
    {
      "id": "MPA-CHARLIE",
      "name": "Windward Patrol",
      "platform": "Maritime Patrol Aircraft",
      "heading": 278,
      "speed_kts": 110,
      "sensor_radius_km": 32,
      "default_sector_id": "SEC-SOUTH",
      "track": [
        [19.9800, -75.1000],
        [20.2600, -75.6800],
        [20.6200, -76.2800],
        [21.0200, -76.9800],
        [21.3800, -77.6200],
        [21.7600, -78.2600]
      ]
    }
  ],
  "red_forces": [
    { "id": "SAM-001", "name": "Havana SAM Belt", "lat": 22.9400, "lon": -82.2800, "priority": "high", "type": "SAM Site", "threat_radius_km": 35 },
    { "id": "SAM-002", "name": "Sancti Spiritus SAM Battery", "lat": 21.9500, "lon": -79.5200, "priority": "high", "type": "SAM Site", "threat_radius_km": 29 },
    { "id": "SAM-003", "name": "Santiago SAM Battery", "lat": 20.0200, "lon": -75.7900, "priority": "high", "type": "SAM Site", "threat_radius_km": 31 },
    { "id": "RADAR-001", "name": "Matanzas Radar Node", "lat": 23.1400, "lon": -81.6500, "priority": "medium", "type": "Radar Node", "threat_radius_km": 48 },
    { "id": "RADAR-002", "name": "Camaguey Radar Node", "lat": 21.5000, "lon": -77.7600, "priority": "medium", "type": "Radar Node", "threat_radius_km": 42 },
    { "id": "LOG-001", "name": "Central Logistics Depot", "lat": 22.1800, "lon": -79.9800, "priority": "medium", "type": "Logistics Depot", "threat_radius_km": 14 },
    { "id": "LOG-002", "name": "Eastern Logistics Depot", "lat": 20.2600, "lon": -76.7200, "priority": "medium", "type": "Logistics Depot", "threat_radius_km": 13 }
  ],
  "patrol_sectors": [
    { "id": "SEC-CAPITAL", "name": "Capital Arc", "lat": 22.7000, "lon": -81.7000, "radius_km": 92, "focus": "northern air approaches" },
    { "id": "SEC-CENTER", "name": "Central Corridor", "lat": 21.4500, "lon": -78.5500, "radius_km": 95, "focus": "inland radar belt" },
    { "id": "SEC-SOUTH", "name": "Southern Littoral", "lat": 20.6500, "lon": -76.1500, "radius_km": 88, "focus": "southern maritime lanes" }
  ],
  "risk_zones": [
    { "id": "RISK-DELTA", "name": "SAM Concentration Fan", "lat": 22.2500, "lon": -80.6000, "radius_km": 170, "weight": 5, "level": "high" },
    { "id": "RISK-ECHO", "name": "Radar Triangulation Zone", "lat": 21.3500, "lon": -77.9500, "radius_km": 135, "weight": 3, "level": "medium" },
    { "id": "RISK-FOXTROT", "name": "Coastal Sustainment Corridor", "lat": 20.4200, "lon": -76.1000, "radius_km": 100, "weight": 2, "level": "medium" }
  ],
  "scripted_events": [
    { "tick": 2, "type": "warning", "severity": "medium", "summary": "Surge scenario activated", "detail": "Synthetic surge package increases red force readiness across the center of the island." },
    { "tick": 4, "type": "report", "severity": "info", "summary": "Blue patrols widen search pattern", "detail": "ISR coverage expands to absorb synthetic radar activity." },
    { "tick": 7, "type": "warning", "severity": "high", "summary": "Red logistics network hardens", "detail": "Two synthetic depots report convoy dispersal measures." },
    { "tick": 10, "type": "report", "severity": "info", "summary": "Replay reaches synthetic consolidation phase", "detail": "Mission replay shows blue forces holding coverage over central threat arcs." }
  ]
}
